{
  "protocol": "commitment/v1",
  "kind": "receipt",
  "receiptId": "f0000000-0000-4000-8000-000000000001",
  "missionId": "11111111-1111-4111-8111-111111111111",
  "outcome": "completed",
  "pactDigest": "HnavHPOFRHxw1qf08QBBLrhuPFU--glfe0cO4PROY3U",
  "eventChainHead": "4MuED5wQ9DLDY4V5nbztrZYwV03_Q3VJDGk8dtETrko",
  "artifacts": [
    {
      "artifactId": "c0000000-0000-4000-8000-000000000001",
      "roleSlotId": "66666666-6666-4666-8666-666666666666",
      "producingAgentId": "33333333-3333-4333-8333-333333333333",
      "contentDigest": "yxASHU4lllOLw2Qaz5OdGbGsr6V-34nqsSwVqYGmn_I"
    },
    {
      "artifactId": "c0000000-0000-4000-8000-000000000002",
      "roleSlotId": "77777777-7777-4777-8777-777777777777",
      "producingAgentId": "55555555-5555-4555-8555-555555555555",
      "contentDigest": "6rRzde3c6cQf76VQ6-Kw98xDoN0NmdIFWZNfKNyxCOI"
    }
  ],
  "verification": {
    "verificationRunId": "e0000000-0000-4000-8000-000000000001",
    "status": "passed",
    "criterionResults": [
      {
        "criterionId": "a0000000-0000-4000-8000-000000000004",
        "status": "passed"
      },
      {
        "criterionId": "a0000000-0000-4000-8000-000000000005",
        "status": "passed"
      }
    ]
  },
  "timeliness": {
    "overdue": false,
    "deliveryDeadline": "2026-08-26T13:00:00.000Z",
    "completedAt": "2026-08-26T12:50:01.000Z"
  },
  "defaults": [
    {
      "agentId": "44444444-4444-4444-8444-444444444444",
      "roleSlotId": "77777777-7777-4777-8777-777777777777",
      "reason": "participant-defaulted"
    }
  ],
  "replacements": [
    {
      "replacementId": "d0000000-0000-4000-8000-000000000001",
      "roleSlotId": "77777777-7777-4777-8777-777777777777",
      "predecessorAgentId": "44444444-4444-4444-8444-444444444444",
      "replacementAgentId": "55555555-5555-4555-8555-555555555555"
    }
  ],
  "reward": {
    "basePointsAwarded": 600,
    "recoveryBonusAwarded": 25,
    "totalPointsAwarded": 625,
    "transferable": false,
    "redeemable": false,
    "monetaryValue": false
  },
  "reputationDeltas": [
    {
      "agentId": "33333333-3333-4333-8333-333333333333",
      "capability": "accessibility-audit",
      "pointsDelta": 300,
      "reliabilityDelta": 0.02,
      "timelinessDelta": 0.01,
      "recoveryBonus": 0,
      "reason": "verified-role-output"
    },
    {
      "agentId": "44444444-4444-4444-8444-444444444444",
      "capability": "remediation-planning",
      "pointsDelta": 0,
      "reliabilityDelta": -0.1,
      "timelinessDelta": 0,
      "recoveryBonus": 0,
      "reason": "post-bind-default"
    },
    {
      "agentId": "55555555-5555-4555-8555-555555555555",
      "capability": "remediation-planning",
      "pointsDelta": 325,
      "reliabilityDelta": 0.03,
      "timelinessDelta": 0.01,
      "recoveryBonus": 25,
      "reason": "verified-replacement-output"
    }
  ],
  "issuerKeyId": "f0000000-0000-4000-8000-000000000002",
  "issuerSignature": "geeS8OfkZu58SbruseOyMNxOx99WeNxotlKprYIsx-wJumv1iMANhB8JidULFPmTjDs-wuATE4w6vJ0URig2IA",
  "issuedAt": "2026-08-26T12:50:02.000Z"
}
